show_id,name,image,genres,language,type,status,premiered,avg_runtime_minutes,rating,platform,seasons_count,episodes_count,cast,summary
387,Rookie Blue,https://static.tvmaze.com/uploads/images/medium_portrait/2/5609.jpg,"Drama, Action, Crime",English,Scripted,Ended,2010-06-24,60,7.5,Global,6,74,"Missy Peregrym, Gregory Smith, Enuka Okuma, Charlotte Sullivan, Matt Gordon, Ben Bass, Travis Milne, Peter Mooney, Priscilla Faia, Lyriq Bent, Rachael Ancheril, Eric Johnson, Melanie Nicholls-King, Noam Jenkins, Aidan Devine, Camille Sullivan","The stakes are high for five young cops fresh out of the Academy and ready for their first day with one of the most elite units in the city. Under the watchful guidance of their officers, Andy McNally and her four fellow rookies quickly learn that no amount of training could prepare them for this new world where every day is a first. Each case they tackle and choice they make will impact their lives, but it's their personal relationships that may play an even greater role in defining the cops they become."
388,The Late Late Show with Craig Ferguson,https://static.tvmaze.com/uploads/images/medium_portrait/2/5775.jpg,Comedy,English,Talk Show,Ended,2005-01-03,60,6.9,CBS,11,2119,"Craig Ferguson, Shadoe Stevens, Josh Robert Thompson","Craig Ferguson entered the world of late night comedy following a diverse and eclectic career that encompasses film, television and the stage. Since taking the helm of The Late Late Show with Craig Ferguson on January 3, 2005, the show has set all-time viewer records and achieved the highest ratings since the shows inception in 1995."
390,Last Call with Carson Daly,https://static.tvmaze.com/uploads/images/medium_portrait/2/5774.jpg,,English,Talk Show,Ended,2002-01-08,30,7.502947368421053,NBC,18,1958,Carson Daly,"Currently in its 13th season on NBC, Last Call with Carson Daly continues to push the boundaries of late night television. Each night, Last Call hits the streets, taking the entire show on location and bringing viewers along for the ride. Host Carson Daly introduces his audience to the emerging artists, stories and music you simply won't find anywhere else. In recent years, Last Call has garnered acclaim for its gritty documentary style, emphasis on great storytelling and status as late night TV's unofficial music tastemaker."
391,Life Is Toff,https://static.tvmaze.com/uploads/images/medium_portrait/2/5943.jpg,,English,Documentary,Ended,2014-10-28,30,7.502947368421053,BBC Three,1,6,"Rupert Houseman, Arthur Fulford, Edmund Fulford, Francis Fulford, Humphrey Fulford, Matilda Fulford","Factual entertainment series following the eccentric and aristocratic Fulford family at home on their 800-year-old country estate, as the children grapple with coming-of-age."
392,Hunted,https://static.tvmaze.com/uploads/images/medium_portrait/2/5944.jpg,"Drama, Action, Thriller",English,Scripted,Ended,2012-10-04,60,8.0,BBC One,1,8,"Melissa George, Adam Rayner, Stephen Dillane, Stephen Campbell Moore, Adewale Akinnuoye-Agbaje, Morven Christie, Lex Shrapnel, Oscar Kennedy, Patrick Malahide, Scott Handy, Dhafer L'Abidine","Sam is a spy, a hunter who now finds herself hunted by a ruthless hidden enemy. Trapped in an intricate web of suspense and paranoia, she must discover who wants her dead by confronting her past."
393,Video Game High School,https://static.tvmaze.com/uploads/images/medium_portrait/403/1009705.jpg,"Comedy, Action, Science-Fiction",English,Scripted,Ended,2012-05-11,30,7.5,rocketjump.com,3,21,"Josh Blaylock, Johanna Braddy, Ellary Porterfield, Brian Firenzi, Benji Dolly, Rocky Collins, Freddie Wong, Zachary Levi, Harley Morenstein, Justine Ezarik, Jimmy Wong","Video Game High School (VGHS) is an action/comedy web series about best friends, first loves, and landing that perfect head shot.The series is set in the near future where video gaming elevates its best players to stardom by its position as the world's most popular competitive sport. VGHS is an elite and prestigious facility that teaches a curriculum of video games of all genres.A classic high school dramedy, mixed with kick ass action and more than a little love of video games."
394,Call the Midwife,https://static.tvmaze.com/uploads/images/medium_portrait/608/1520011.jpg,"Drama, Medical",English,Scripted,Running,2012-01-15,60,8.0,BBC One,15,117,"Jenny Agutter, Vanessa Redgrave, Laura Main, Judy Parfitt, Stephen McGann, Cliff Parisi, Helen George, Linda Bassett, Annabelle Apsion, Georgie Glen, Zephryn Taitte, Leonie Elliott, Victoria Yeates, Bryony Hannah, Daniel Laurie, Pam Ferris, Ella Bruccoleri, Fenella Woolgar, Rebecca Gethings, Jack Ashton, Megan Cusack, Jennifer Kirby, Ben Caplan, Olly Rix, Charlotte Ritchie, Emerald Fennell, Renee Bailey, Natalie Quarry, Jessica Raine, Miranda Hart, Molly Vevers",Drama following the lives of a group of midwives working in the poverty-stricken East End of London during the 1950s &amp; decades following.  Based on the best-selling memoirs of Jennifer Worth.
395,Longmire,https://static.tvmaze.com/uploads/images/medium_portrait/74/186713.jpg,"Drama, Thriller, Western",English,Scripted,Ended,2012-06-03,60,8.3,Netflix,6,63,"Katee Sackhoff, Lou Diamond Phillips, Robert Taylor, Adam Bartley, Cassidy Freeman, Bailey Chase","Longmire, a contemporary crime thriller set in Big Sky country, is based on the Walt Longmire Mystery novels by best-selling author Craig Johnson. It focuses on a Wyoming sheriff who's rebuilding his life and career following the death of his wife."
396,Gravity Falls,https://static.tvmaze.com/uploads/images/medium_portrait/2/6140.jpg,"Adventure, Mystery, Supernatural",English,Animation,Ended,2012-06-15,30,8.9,Disney XD,2,40,"Jason Ritter, Kristen Schaal, Alex Hirsch, Alex Hirsch, Linda Cardellini, Alex Hirsch, Alex Hirsch","Twin brother and sister Dipper and Mabel Pines are in for an unexpected adventure when they spend the summer with their great Uncle in the mysterious town of Gravity Falls, Oregon."
397,Don't Trust the B---- in Apartment 23,https://static.tvmaze.com/uploads/images/medium_portrait/2/6145.jpg,Comedy,English,Scripted,Ended,2012-04-11,30,7.6,ABC,2,26,"Krysten Ritter, Dreama Walker, James Van Der Beek, Eric André, Ray Ford, Michael Blaiklock, Liza Lapira","After a naive Midwestern girl's big city dreams are dashed during her first week in New York, she finds herself living with her worst nightmare, in a hilarious, contemporary comedy about a female odd couple who are surrounded by an outrageous cast of characters.On May 23 2012, the first season ended its broadcast run; seven episodes were aired, although the initial order consisted of 13 episodes. Thus, six episodes were carried over into the following broadcast run, bringing the second season to 19 episodes. ABC elected to air the six remaining episodes out of order, interspersing first and second season episodes without regard to continuity. As a result, some multi-episode plot arcs (particularly James's appearance on Dancing with the Stars and June's travails at a new job outside the coffee shop) are almost incomprehensibly jumbled in the original broadcast order."
398,Duck Dynasty,https://static.tvmaze.com/uploads/images/medium_portrait/543/1357532.jpg,"Comedy, Adventure",English,Reality,Ended,2012-03-21,31,5.8,A&E,11,131,"Willie Robertson, Jase Robertson, Si Robertson, Jep Robertson, Miss Kay Robertson, Korie Robertson, John Godwin, Phil Robertson, Justin Martin, Missy Robertson, Jessica Robertson, Sadie Robertson, John Luke Robertson, Alan Robertson, Beau Bailey","In Duck Dynasty, A&amp;E Network introduces the Robertsons, a Louisiana bayou family living the American dream as they operate a thriving business while staying true to their family values and lifestyle. Ask anyone in Louisiana and they'll tell you that the bayou state's favorite first family doesn't live in the governor's mansion but in the backwoods, where the Robertsons' rags-to-riches story is still unfolding. A ...homegrown mom-and-pop operation, Duck Commander has become a sporting empire by fabricating top-of-the-line duck calls and decoys out of salvaged swamp wood. This newly minted multimillionaire family is kept in line by business-savvy Willie, who runs Duck Commander with the help of his brother Jase, their respective wives Korie and Missy, patriarch and founder of the company, Phil, and uncle Si. Together they run a booming business that employs half their neighborhood, but at the end of the day, you can find the whole family around matriarch Miss Kay's dinner table. Each episode brings a new set of challenges, met with a special brand of Southern know-how and a down-home sense of humor."
399,The Client List,https://static.tvmaze.com/uploads/images/medium_portrait/486/1215695.jpg,"Drama, Romance",English,Scripted,Ended,2012-04-08,60,6.5,Lifetime,2,25,"Jennifer Love Hewitt, Loretta Devine, Rebecca Field, Colin Egglesfield, Alicia Lagano, Brian Hallisay, Cybill Shepherd, Naturi Naughton, Kathleen York, Laura-Leigh","The Client List is about Texas housewife; Riley Parks, who, after being deserted by her husband, is left in serious financial straits and takes a job at a seemingly traditional day spa in a neighboring town. But when she realizes some of her co-workers also provide other services, Riley must make the difficult decision whether or not to embrace an opportunity for her to resolve her financial hardships. The series will follow Riley as she delicately balances a moral conflict between two starkly different lives -- one as a single mother in a conservative town struggling to provide for her family and the other as a savvy and ambitious businesswoman working with a raucous, sexy and unpredictable group of women. As Riley becomes more involved, she struggles while working in secrecy knowing her family and friends would disapprove of her decision."
400,Copper,https://static.tvmaze.com/uploads/images/medium_portrait/2/6166.jpg,"Drama, Crime",English,Scripted,Ended,2012-08-19,60,7.7,BBC America,2,23,"Ato Essandoh, Kevin Ryan, Tom Weston-Jones, Anastasia Griffith, Dylan Taylor, Franka Potente, Kyle Schmid, Tessa Thompson, Kiara Glasco, Ron White, Alex Paxton-Beesley, David Keeley, Tanya Fischer, Rick Roberts","Copper is an American saga set in 1865 New York City, picks-up on the brink of Lincoln's assassination - with shifts in politics and society altering the landscape for Irish immigrants and African-Americans. At the center, Detective Kevin Corcoran struggles to tame the wartime metropolis while wrestling with personal demons, including the betrayal of his wife and best friend. And when Tammany Hall's outspoken General Brendan Donovan returns from the Civil War to restore law and order in the Sixth Ward, loyalties will be bought and sold both Uptown and in the slums of the Five Points as Corcoran, and those around him, fight to find their places in an unforgiving city."
401,Smash,https://static.tvmaze.com/uploads/images/medium_portrait/2/6176.jpg,Drama,English,Scripted,Ended,2012-02-06,60,7.9,NBC,2,32,"Debra Messing, Jack Davenport, Katharine McPhee, Christian Borle, Megan Hilty, Anjelica Huston, Leslie Odom Jr., Jeremy Jordan, Jaime Cepero, Raza Jaffrey, Brian d'Arcy James, Krysta Rodriguez, Andy Mientus","The hit-making Broadway writing team of Julia Houston and Tom Levitt unites with producer Eileen Rand to create a new musical based on the life of Marilyn Monroe, and seasoned chorus girl Ivy Lynn vies with newcomer Karen Cartwright for the dream role."
402,A Young Doctor's Notebook,https://static.tvmaze.com/uploads/images/medium_portrait/2/6183.jpg,"Drama, Comedy",English,Scripted,Ended,2012-12-06,30,7.5,Sky Arts,2,8,"Daniel Radcliffe, Jon Hamm",Daniel Radcliffe and Jon Hamm star in a comedy drama based on Mikhail Bulgakov's experiences as an inexperienced doctor in a remote Russian village.
403,Touch,https://static.tvmaze.com/uploads/images/medium_portrait/397/994969.jpg,"Drama, Science-Fiction, Mystery",English,Scripted,Ended,2012-01-25,60,7.5,FOX,2,26,"Kiefer Sutherland, David Mazouz, Maria Bello, Lukas Haas, Saxon Sharbino, Saïd Taghmaoui, Gugu Mbatha-Raw, Danny Glover","Martin Bohm is a widower and single father who is haunted by an inability to connect to his emotionally challenged 11-year-old son Jake. But when Martin discovers that Jake can predict events before they happen, everything changes. Martin meets social worker Clea Hopkins and Professor Arthur Teller who may have the keys to help unlock Jake's mind."
404,Magic City,https://static.tvmaze.com/uploads/images/medium_portrait/179/449238.jpg,"Drama, Crime, Mystery",English,Scripted,Ended,2012-03-30,60,7.9,STARZ,2,16,"Jeffrey Dean Morgan, Olga Kurylenko, Steven Strait, Jessica Marais, Christian Cooke, Danny Huston, Elena Satine, Dominik Garcia-Lorido, Kelly Lynch, Taylor Blackwell","Miami Beach, 1959.As Ike Evans rings in the New Year at his luxurious Miramar Playa Hotel, Havana falls to Castro's rebels. It's a turbulent time in Miami, but it's the place to be. The Kennedys, the mob and the CIA all hold court here. And Ike, he's the star of his hotel. But everything comes at a price. To finance his dream, he sold his soul to mob boss Ben ""The Butcher"" Diamond. Ike's wife Vera, a former showgirl, and his three kids think he's an honorable man, but he can't break his pact with the devil. His life is a façade. In fact, nothing at the Miramar Playa is what it seems. By day, it's diving clowns and cha-cha lessons. By night, escorts have secret liaisons with husbands in the family cabanas, while Miami's seedier residents and the law drift together to hear legendary singers, musicians and comics. As Ike's world threatens to implode, he fights for his family, and the Miramar Playa, in Magic City."
405,Derek,https://static.tvmaze.com/uploads/images/medium_portrait/2/6206.jpg,"Drama, Comedy",English,Scripted,Ended,2012-04-12,30,8.0,Channel 4,2,12,"Kerry Godliman, Ricky Gervais, David Earl, Arthur Nightingale, Karl Pilkington, Tim Barlow, Brett Goldstein, Kay Noone, Holli Dempsey, Ruth Bratt, Ben Bailey Smith, Vilma Hollingbery, Joan Linder","An award-winning bittersweet comedy-drama about a group of outsiders living on society's margins, Derek centers around Derek Noakes (a tender, innocent man whose love for his job at a retirement home shines through. Derek cares deeply for the home's residents, because they are kind and funny and tell him stories of what life used to be like. Working alongside Derek is Dougie, his landlord, who is one of life's unlucky individuals; Kev, a lovable train wreck; and Hannah, a care worker in the home and Derek's best friend. She is smart, witty and hardworking, but unlucky in love, and, like Derek, always puts other people first."
406,Men at Work,https://static.tvmaze.com/uploads/images/medium_portrait/2/6214.jpg,"Drama, Comedy",English,Scripted,Ended,2012-05-24,30,6.9,TBS,3,30,"Danny Masterson, Michael Cassidy, Adam Busch, James Lesure, Meredith Hagner","Men at Work is a brazen new original comedy about four hip, young professionals set to take on New York and live life ""Full Steam"" - ahead just like the name of the magazine that they work for. They follow the ""boys will be boys"" mantra of single, 30-somethings navigating work, friendship, and women."
407,Mortal Kombat: Legacy,https://static.tvmaze.com/uploads/images/medium_portrait/399/999495.jpg,"Action, Adventure, Fantasy",English,Scripted,Ended,2011-04-12,10,7.3,Machinima,2,19,,"In the beginning, the universe and its realms were in harmony, but even gods are not immune to power and greed. This balance was soon thrown into discord. The power-hungry gods challenged each other over the fates of their respective realms. They battled to the death in tournaments alongside mortal champions chosen from each realm. For millennia, Shao Kahn—the Emperor of Outworld—has successfully expanded his domain by defeating other realms. Edenia was the last realm to lose the tournament and fall to Shao Kahn. Ten years ago in the last tournament, Outworld and Earth-realm's warriors clashed, and Liu Kang emerged victorious. Earth-realm was spared. But now Shao Kahn's challenge has come again, and a new war is about to commence. The fate of Earth-realm and its inhabitants rests upon the outcome of this tournament. Let the kombat begin."
408,Jane by Design,https://static.tvmaze.com/uploads/images/medium_portrait/302/755993.jpg,"Drama, Comedy",English,Scripted,Ended,2012-01-03,60,7.8,Freeform,1,18,"Erica Dasher, Nick Roux, Andie MacDowell, India de Beaufort, Matthew Atkinson, Meagan Tandy, Rowly Dennis, Nazneen Contractor, Annie Little, Brooke Lyons, Greg Vaughan, Sahlima, Todd Sherry","Jane by Design follows Jane Quimby a quirky teen with an eclectic chic fashion sense who lands a job at a hip fashion house when they mistake her for an adult. Torn between her love of fashion and the need to finish high school, Jane conceals her true age to assist the demanding, but talented Gray Chandler Murray who travels the world in search of the next big style trend."
409,Invader ZIM,https://static.tvmaze.com/uploads/images/medium_portrait/2/6242.jpg,Children,English,Animation,Ended,2001-03-30,30,7.8,Nickelodeon,2,46,"Richard Steven Horvitz, Rosearik Rikki Simons, Andy Berman, Melissa Fahn, Rodger Bumpass, Wally Wingert, Kevin McDonald, Lucille Bliss","Invader ZIM is an eccentric alien soldier from the planet Irk. He was banished from the Irken Empire after nearly destroying his home planet on an early mission. After begging his superiors, the Almighty Tallest Red and Purple, for another chance, they decide to get rid of him once and for all. They trick him into going on a ""secret mission"" to an obscure planet at the edge of the universe, a planet with the unlikely name of Earth, in hopes that he'll die along the way. But their trick backfires when ZIM safely reaches Earth and begins his ever-so-subtle conquest of it. He disguises himself as a schoolboy, and now the only person who can stop him is one kid - Dib, a somewhat insane paranormal researcher, who sees straight through ZIM's disguise and is intent on stopping his reign of ""terror"". The only problem is that neither of them is very good at stopping the other."
411,The Cape,https://static.tvmaze.com/uploads/images/medium_portrait/2/6361.jpg,"Drama, Crime, Supernatural",English,Scripted,Ended,2011-01-09,60,6.5,NBC,1,10,"David Lyons, Keith David, Summer Glau, Jennifer Ferrin, Ryan Wynott, Martin Klebba, Dorian Missick, Vinnie Jones, James Frain","Fueled by a desire to reunite with his wife Dana and son Trip, Vince Faraday takes the law into his own hands to battle criminal forces that have overtaken Palm City. Faraday is joined by Max Malini, the ringleader of a circus gang of bank robbers, who mentors Faraday and trains him to become The Cape, as well as investigative blogger Orwell who wages war on crime and corruption in Palm City. Together, they must battle Ark corporation billionaire Peter Fleming -- The Cape's nemesis -- who moonlights as the twisted killer ""Chess."""
412,Fairly Legal,https://static.tvmaze.com/uploads/images/medium_portrait/305/763631.jpg,Drama,English,Scripted,Ended,2011-01-20,60,7.8,USA Network,2,23,"Sarah Shahi, Michael Trucco, Virginia Williams, Baron Vaughn, Ryan Johnson","Fairly Legal centers on Kate Reed, a top litigator frustrated with the endless bureaucracy and daily injustices of the system, who takes a hard left to become the ultimate anti-lawyer: a mediator. Using her knowledge of the law, along with her savvy, intuition and a whatever-it-takes approach to resolving conflict, Kate finds the middle ground for a wide variety of adversaries - from Fortune 500 corporations to bitter divorces. After the sudden death of her father, she finds herself at odds with the new boss, her stepmother Lauren Reed... and in bed with her soon-to-be ex-husband, Justin Patrick, a top gun in the DA's office. Helping her keep all of this chaos at bay is her trusted, geek-chic assistant Leonardo."
413,Whitney,https://static.tvmaze.com/uploads/images/medium_portrait/2/6377.jpg,"Comedy, Romance",English,Scripted,Ended,2011-09-22,30,7.2,NBC,2,38,"Whitney Cummings, Chris D'Elia, Rhea Seehorn, Zoe Lister-Jones, Daniel G. O'Brien, Maulik Pancholy, Tone Bell","They say marriage is the number one cause of divorce. For Alex and Whitney, it's one of many reasons they're determined not to take the plunge.After going to yet another one of their friends' weddings, Whitney realizes that she and Alex are dangerously close to relationship boredom. She sees it happen all the time: pretty soon you're not dressing up for each other, you're not having enough sex, and you start fighting. Determined not to let that happen to them, Whitney consults her close circle of (opinionated) friends and snaps into action. A few awkward sexy costumes and one botched seductive evening later, they end up in the ER after Alex gets a concussion from a compromising position. Not exactly the mind-blowing experience she wanted, but you know what? That's all right. Their relationship might not be perfect on paper, but it works and they really do love each other.Bright young comedian Whitney Cummings brings her unique and hilarious perspective on love to this new comedy series that proves there's no right way to be together... but there are plenty of wrong ways."
415,Olive Kitteridge,https://static.tvmaze.com/uploads/images/medium_portrait/2/6858.jpg,Drama,English,Scripted,Ended,2014-11-02,60,8.0,HBO,1,4,"Frances McDormand, Richard Jenkins, Martha Wainwright, John Gallagher, Jr., Ann Dowd, Peter Mullan, Bill Murray, Jesse Plemons, Rosemarie DeWitt, Zoe Kazan, Donna Mitchell, Brady Corbet, Rachel Brosnahan, Patricia Kalember, Maryann Urbano, Audrey Marie Anderson","Based on Elizabeth Strout's Pulitzer Prize-winning novel of the same name, Olive Kitteridge tells the poignantly sweet, acerbically funny and devastatingly tragic story of a seemingly placid New England town wrought with illicit affairs, crime and tragedy, told through the lens of a woman whose wicked wit and harsh demeanor mask a warm but troubled heart and a staunch moral center."
416,Are You the One?,https://static.tvmaze.com/uploads/images/medium_portrait/494/1235413.jpg,Romance,English,Reality,Ended,2014-01-21,61,5.5,Paramount+,9,104,"Ryan Devlin, Terrence Jenkins, Kamie Crawford","Are You the One? will follow a group of 10 single women and 10 single men who are self-admittedly horrible at relationships, as they jet off to Puerto Rico in the hopes they'll leave their bad relationship habits behind and surrender to their perfect match.Prior to arrival, the singles will undergo a rigorous matchmaking process involving in-depth interviews and compatibility testing, using a team of professional matchmakers, psychologists, and the contestants' family, friends, and exes. An ideal match for each person will be selected - the catch is that the results are not revealed. The singles will begin their quest to find their perfect match in the house. If the entire group succeeds in finding their matches during the season, they'll walk away not only with love, but their share of one million dollars. All 10 couples must match, or they'll all go home without the cash!"
417,MasterChef Junior,https://static.tvmaze.com/uploads/images/medium_portrait/507/1267821.jpg,"Children, Food",English,Reality,Ended,2013-09-27,60,6.9,FOX,9,107,"Gordon Ramsay, Christina Tosi, Aarón Sánchez, Joe Bastianich, Graham Elliot, Daphne Oz, Tilly Ramsay, Charlie Ryan",MasterChef Junior goes back for seconds...and thirds! This culinary competition series gives talented kids between the ages of eight and 13 the chance to showcase their culinary abilities and passion for food through a series of delicious challenges.
418,Chrisley Knows Best,https://static.tvmaze.com/uploads/images/medium_portrait/445/1113406.jpg,"Comedy, Family",English,Reality,Ended,2014-03-11,30,5.4,USA Network,10,203,"Todd Chrisley, Julie Chrisley, Chase Chrisley, Savannah Chrisley, Grayson Chrisley, Faye Chrisley, Chloe Chrisley, Kyle Chrisley, Lindsie Chrisley Campbell, Jackson Campbell","Chrisley Knows Best is a real-life family comedy, which broke its ratings record on its second season premiere, follows the entertaining lives of Atlanta-based ""Patriarch of Perfection"" Todd Chrisley, and his colorful clan including his wife, five children and two grandchildren."
419,Snooki & JWoww,https://static.tvmaze.com/uploads/images/medium_portrait/2/6872.jpg,,English,Reality,Ended,2012-06-21,46,5.3,MTV,4,48,"Jenni Farley, Nicole Polizzi","The show returns with 12 all-new episodes chronicling the zany antics of Nicole ""Snooki"" Polizzi, Jenni ""JWOWW"" Farley, their fiancés Jionni LaValle and Roger Mathews, and their new babies. In what is sure to be their wildest season yet, fans will witness the besties as they tackle life milestones including new motherhood and upcoming nuptials.Over the past five years, viewers have fallen in love with Snooki and JWOWW, who have become a modern day Laverne and Shirley, watching them go from party girls to motherhood and roommates to wombmates, while trading in beer for baby bottles. Now it's time to say goodbye and see how it all ends."
420,Slednecks,https://static.tvmaze.com/uploads/images/medium_portrait/2/6873.jpg,,English,Reality,Ended,2014-10-30,30,7.502947368421053,MTV,1,18,,"MTV is heading to Alaska with new series, Slednecks. The weekly half-hour comedic docu-series follows a close group of adventurous friends living in rural Wasilla, Alaska.Polar Bear plunges, airboating on ice, glacier parties, river wakeboarding, and human catapulting are just some of the action-packed adventures these 'Slednecks' get into, while also navigating dramatic friendships and relationships in the prime of their lives. With mountains and rivers as their playground, these friends make the most of what they have while always having a blast."
