show_id,name,image,genres,language,type,status,premiered,avg_runtime_minutes,rating,platform,seasons_count,episodes_count,cast,summary
118,House,https://static.tvmaze.com/uploads/images/medium_portrait/357/894990.jpg,"Drama, Mystery, Medical",English,Scripted,Ended,2004-11-16,60,8.8,FOX,8,176,"Hugh Laurie, Robert Sean Leonard, Omar Epps, Jesse Spencer, Lisa Edelstein, Jennifer Morrison, Peter Jacobson, Olivia Wilde, Kal Penn, Odette Annable, Charlyne Yi, Amber Tamblyn","Sink your teeth into meaty drama and intrigue with House, FOX's take on mystery, where the villain is a medical malady and the hero is an irreverent, controversial doctor who trusts no one, least of all his patients.Dr. Gregory House is a maverick physician who is devoid of bedside manner. While his behavior can border on antisocial, Dr. House thrives on the challenge of solving the medical puzzles that other doctors give up on. Together with his hand-picked team of young medical experts, he'll do whatever it takes in the race against the clock to solve the case."
120,Transparent,https://static.tvmaze.com/uploads/images/medium_portrait/210/525553.jpg,"Drama, Comedy",English,Scripted,Ended,2014-09-26,28,7.3,Prime Video,5,40,"Gaby Hoffmann, Jay Duplass, Amy Landecker, Judith Light, Jeffrey Tambor, Melora Hardin, Kathryn Hahn","In Transparent, an LA family with serious boundary issues have their past and future unravel when a dramatic admission causes everyone's secrets to spill out."
122,Nikita,https://static.tvmaze.com/uploads/images/medium_portrait/545/1362913.jpg,"Drama, Action, Crime",English,Scripted,Ended,2010-09-09,60,7.8,The CW,4,73,"Maggie Q, Shane West, Lyndsy Fonseca, Aaron Stanford, Melinda Clarke, Dillon Casey, Xander Berkeley, Noah Bean, Devon Sawa, Tiffany Hines, Ashton Holmes","When she was a deeply troubled teenager, Nikita was rescued from death row by a secret U.S. agency known only as Division, who trained her as a spy and assassin. Nikita was eventually betrayed by the only people she thought she could trust. Now, after three years in hiding, Nikita is seeking retribution and making it clear to her former boss, Percy and her former friends Michael and Birkhoff that she will stop at nothing to expose and destroy their covert operation."
123,Lost,https://static.tvmaze.com/uploads/images/medium_portrait/0/1389.jpg,"Drama, Adventure, Supernatural",English,Scripted,Ended,2004-09-22,60,8.2,ABC,6,121,"Matthew Fox, Evangeline Lilly, Jorge Garcia, Josh Holloway, Terry O'Quinn, Naveen Andrews, Daniel Dae Kim, Kim Yoon Jin, Emilie de Ravin, Dominic Monaghan, Michael Emerson, Harold Perrineau, Elizabeth Mitchell, Henry Ian Cusick, Ken Leung, Maggie Grace, Jeremy Davies, Néstor Carbonell, Rebecca Mader, Ian Somerhalder, Jeff Fahey, Malcolm David Kelley, Michelle Rodriguez, Adewale Akinnuoye-Agbaje, Cynthia Watros, Zuleikha Robinson, Rodrigo Santoro, Kiele Sanchez","Out of the blackness, the first thing Jack senses is pain. Then burning sun. A Bamboo forest. Smoke. Screams. With a rush comes the horrible awareness that the plane he was on tore apart in mid-air and crashed on a Pacific island. From there it's a blur, as his doctor's instinct kicks in: people need his help.Stripped of everything, the 48 survivors scavenge what they can from the plane for their survival. Some panic. Some pin their hopes on rescue. A few find inner strength they never knew they had -- like Kate, who, with no medical training, suddenly finds herself suturing the doctor's wounds. Hurley - a man with a warm sense of humor despite the desperate situation - does his best to keep his cool as he helps those around him to survive. Charlie is a faded rock star who harbors a painful secret. Sayid is a Middle Eastern man who must wrestle with the racial profiling directed at him by some of his fellow survivors. Jin and Sun are a Korean couple whose traditions, values and language are foreign, and thus causes much to get lost in the translation. Sawyer has an air of danger surrounding him, and his intense sense of mistrust for everyone around him could prove to be fatal to his fellow castaways. Michael has just gained custody of his nine-year-old son, Walt, after the death of his ex-wife - they are a father and son who don't even know each other. Locke is a mysterious man who keeps to himself, and who harbors a deeper connection to the island than any of the others. Self-centered Shannon - who actually gives herself a pedicure amid the chaos - and her estranged controlling brother, Boone , constantly bicker and must learn to get along if they are to survive. And young Claire is eight months pregnant and ill-prepared for the hardships of motherhood - especially on a deserted island."
124,2 Broke Girls,https://static.tvmaze.com/uploads/images/medium_portrait/63/158548.jpg,Comedy,English,Scripted,Ended,2011-09-19,30,7.2,CBS,6,138,"Kat Dennings, Beth Behrs, Garrett Morris, Matthew Moy, Jonathan Kite, Jennifer Coolidge","2 Broke Girls is a comedy about two young women waitressing at a greasy spoon diner who strike up an unlikely friendship in the hopes of launching a successful business - if only they can raise the cash. Sassy, streetwise Max Black works two jobs just to get by, one of which is waiting tables during the night shift at the retro-hip Williamsburg Diner. Sophisticated Caroline Channing is an uptown trust fund princess who's having a run of bad luck that forces her to reluctantly give waitressing a shot. At first, Max sees Caroline as yet another in a long line of inept servers she must cover for, but she's surprised to find that Caroline has as much substance as she does style.When Caroline discovers Max's knack for baking amazing cupcakes, she sees a lucrative future for them, but first they need to raise the start-up money. While they save their tips, they'll stay at the restaurant, working with Oleg, an overly flirtatious Russian cook; Earl, a 75-year-old kool-kat cashier; and Han Lee, the new, eager-to-please owner of the diner. Working together, these two broke girls living in one expensive city might just find the perfect recipe for their big break."
125,Selfie,https://static.tvmaze.com/uploads/images/medium_portrait/0/1756.jpg,"Comedy, Romance",English,Scripted,Ended,2014-09-30,30,7.1,ABC,1,13,"Allyn Rachel, Da'Vine Joy Randolph, David Harewood, John Cho, Karen Gillan, Tim Peper","Eliza Dooley has 263,000 followers who hang on to her every post, tweet and selfie. But one lonely day, she has a revelation: being friended is not the same as having actual friends. She asks marketing guru Henry to 'rebrand' her self-obsessed reputation and teach her how to connect with people in the real world. Loosely based on My Fair Lady, Selfie explores the modern struggles of Eliza and Henry, as he tries to teach her how to live life offline - whether she 'likes' it or not."
126,Mom,https://static.tvmaze.com/uploads/images/medium_portrait/47/119089.jpg,"Comedy, Family",English,Scripted,Ended,2013-09-23,30,7.6,CBS,8,170,"Allison Janney, Anna Faris, Mimi Kennedy, Beth Hall, Jaime Pressly, William Fichtner, Kristen Johnston, Sadie Calvano, Blake Garrett Rosenthal, Matt L. Jones, Spencer Daniels, French Stewart, Nate Corddry","Christy is a single mom who, after years of questionable choices, is now sober and trying to get her life on track. She's tested daily by her newly sober mother, Bonnie, who is trying to make up for all the ways she's let Christy down. Christy is further challenged by her relationships with her own kids. Her daughter Violet is engaged to a man twice her age and her ten-year-old son, Roscoe, would rather live with his father Baxter, a former slacker who has only recently gotten himself together. To help her stay sober, Christy relies on her support system from AA, comprised of her sponsor Marjorie, her wealthy sponsee, Jill, and her emotional friend, Wendy. Christy tries to remain positive as she attempts to overcome her past and build a better future, but with her dysfunctional family and life's many setbacks, it's always an uphill battle."
127,The Affair,https://static.tvmaze.com/uploads/images/medium_portrait/494/1235104.jpg,"Drama, Romance",English,Scripted,Ended,2014-10-12,61,7.7,Paramount+ with Showtime,5,53,"Dominic West, Maura Tierney, Jadon Sand, Ruth Wilson, Julia Goldani Telles, Leya Catlett, Joshua Jackson, Jake Siciliano, Omar Metwally, Catalina Sandino Moreno, Sanaa Lathan, Anna Paquin, Irène Jacob","At once deeply observed and intriguingly elusive, The Affair explores the emotional effects of an extramarital relationship.Noah is a New York City schoolteacher and novelist who is happily married, but resents his dependence on his wealthy father-in-law. Alison is a young waitress trying to piece her life and marriage back together in the wake of a tragedy. The provocative drama unfolds when Alison and Noah meet in Montauk at the end of Long Island."
128,Jane the Virgin,https://static.tvmaze.com/uploads/images/medium_portrait/591/1478947.jpg,"Drama, Crime, Romance",English,Scripted,Ended,2014-10-13,60,7.3,The CW,5,100,"Justin Baldoni, Gina Rodriguez, Andrea Navedo, Yael Grobglas, Ivonne Coll, Jaime Camil, Brett Dier, Elias Janssen","When Jane Villanueva was a young girl, her grandmother, Alba, convinced her of two things: telenovelas are the highest form of entertainment, and women must protect their virginity at all costs. Jane the Virgin, although she has always tried to be the good girl who does the right thing, Jane's life has suddenly become as dramatic and complicated as the telenovelas she has always loved."
129,Marry Me,https://static.tvmaze.com/uploads/images/medium_portrait/0/1836.jpg,Comedy,English,Scripted,Ended,2014-10-14,30,5.4,NBC,1,18,"Casey Wilson, John Gemberling, Ken Marino, Tymberlee Hill, Sarah Wright Olsen, Tim Meadows, Dan Bucatinsky, JoBeth Williams","Six years ago, Annie and Jake bonded over their mutual love of nachos and they've been inseparable ever since. Now, after returning from a romantic two-week island vacation, Jake's all set to pop the question. Before he can ask, though, Annie lets loose on Jake for his inability to commit. She was expecting him to ""put a ring on it"" in paradise and now Jake's perfect proposal is ruined. Not wanting to spend the next 60 years talking about that mess of a proposal, Jake and Annie decide to hold off on the engagement until they can do it right. Yet if history tells us anything, it's when we really want things to go right that they all tend to go wrong. The only thing we know for sure is these two are destined to be together whether they can get it together or not."
130,Two and a Half Men,https://static.tvmaze.com/uploads/images/medium_portrait/118/296854.jpg,Comedy,English,Scripted,Ended,2003-09-22,30,6.6,CBS,12,262,"Jon Cryer, Angus T. Jones, Conchata Ferrell, Charlie Sheen, Holland Taylor, Ashton Kutcher, Marin Hinkle, Melanie Lynskey, Jennifer Taylor, Amber Tamblyn, April Bowlby, Edan Alexander","Charlie is a well-to-do bachelor with a house at the beach, a Jaguar in the front, and an easy way with women. His casual Malibu lifestyle is interrupted when his tightly wound brother Alan, who's facing a divorce, and his son Jake, come to live with him. Together, these two and a half men confront the challenges of growing up; finally. Complicating matters are the brothers' self-obsessed, controlling mother, Evelyn, Alan's estranged wife, Judith and Charlie's crazy neighbor Rose, who wants to be a part of his life and is willing to do anything to be around. After the death of his brother, Alan Harper meets and befriends a lonely young man named Walden Schmidt who turns out to be a billionaire. Unable to afford his brother's home, Alan sells Walden the house, and as a way of showing his gratitude, Walden allows Alan and his son Jake to move in with him."
131,About a Boy,https://static.tvmaze.com/uploads/images/medium_portrait/0/1880.jpg,"Drama, Comedy, Romance",English,Scripted,Ended,2014-02-22,30,6.5,NBC,2,33,"David Walton, Benjamin Stockham, Minnie Driver, Al Madrigal, Annie Mumolo, Anjelah Johnson-Reyes","Will Freeman lives a charmed existence as the ultimate man-child. After writing a hit song, he was granted a life of free time, free love and freedom from financial woes. He's single, unemployed and loving it. So imagine his surprise when Fiona, a needy, single mom and her oddly charming 11-year-old son Marcus move in next door and disrupt his perfect world."
132,The Millers,https://static.tvmaze.com/uploads/images/medium_portrait/0/1886.jpg,Comedy,English,Scripted,Ended,2013-10-03,30,6.2,CBS,2,34,"Will Arnett, Margo Martindale, Jayma Mays, J.B. Smoove, Nelson Franklin, Beau Bridges, Lulu Wilson, Sean Hayes, Eve Moon","The Millers follows Nathan Miller, a recently divorced local roving news reporter looking forward to living the singles life until his parents' marital problems unexpectedly derail his plans. After Nathan finally breaks the news of his divorce to his parents Carol and Tom, his father is inspired to follow suit and stuns the family when he leaves his wife of 43 years. Already in shock, Nathan is even more aghast when his meddlesome mom decides to move in with him. Meanwhile, his absent-minded dad imposes upon Nathan's sister Debbie, her husband Adam and their daughter. Nathan's best friend and news cameraman Ray was excited to be Nathan's wingman in the dating scene, but Carol manages to even cramp his style. Now, as Nathan and his sister settle in with their truly impossible parents, they both wonder just how long the aggravating adjustment period is going to last."
133,Elementary,https://static.tvmaze.com/uploads/images/medium_portrait/195/488201.jpg,"Drama, Crime, Mystery",English,Scripted,Ended,2012-09-27,60,8.3,CBS,7,154,"Jonny Lee Miller, Lucy Liu, Jon Michael Hill, Aidan Quinn, John Noble, Nelsan Ellis, Desmond Harrington, James Frain","Elementary is a modern-day take on the classic Sherlock Holmes story about a crime-solving duo that cracks the NYPD's most impossible cases. Following his fall from grace in London and a stint in rehab, eccentric Sherlock escapes to Manhattan where his wealthy father forces him to live with his worst nightmare - a sober companion, Dr. Watson."
134,Heroes,https://static.tvmaze.com/uploads/images/medium_portrait/0/1904.jpg,"Drama, Action, Science-Fiction",English,Scripted,Ended,2006-09-25,60,7.7,NBC,4,78,"Jack Coleman, Hayden Panettiere, Milo Ventimiglia, Masi Oka, Sendhil Ramamurthy, James Kyson, Adrian Pasdar, Zachary Quinto, Greg Grunberg, Cristine Rose, Ali Larter, Noah Gray-Cabey, Ali Larter, Robert Knepper, Leonard Roberts, Santiago Cabrera, David Anders, Dania Ramirez, Tawny Cypress, Kristen Bell, Dana Davis","This epic chronicles the lives of ordinary people who discover they possess extraordinary abilities. As a total eclipse casts a shadow across the globe, viewers follow a genetics professor in India whose father's disappearance leads him to uncover a secret theory—there are people with super powers living among us. A young dreamer tries to convince his politician brother that he can fly. A high school cheerleader learns that she is totally indestructible. A Las Vegas stripper, struggling to make ends meet to support her young son, uncovers that her mirror image has a secret. A prison inmate mysteriously finds himself waking up outside of his cell. A gifted artist, whose drug addiction is destroying his life and the relationship with his girlfriend, can paint the future. A down-on-his-luck beat cop can hear people's thoughts, including the secrets of a captured terrorist. In Japan, a young man develops a way to stop time through sheer will power. Their ultimate destiny is nothing less than saving the world."
136,The McCarthys,https://static.tvmaze.com/uploads/images/medium_portrait/0/1900.jpg,"Comedy, Family",English,Scripted,Ended,2014-10-30,30,6.8,CBS,1,15,"Jack McGee, Jimmy Dunn, Joey McIntyre, Kelen Coleman, Laurie Metcalf, Tyler Ritter, Jay Jay Warren, Keegan Boos, Tim Beresford, Timothy E. Goodwin","The McCarthys is a multi-camera comedy about a close-knit, sports-crazed Boston family whose somewhat athletically challenged son, Ronny, is chosen by his father to be his assistant high school basketball coach, much to the surprise of his more qualified siblings. Ronny wants nothing more than to move away, join the singles scene and find a partner. His distraught mother, Marjorie is not upset that her favorite son is gay, but that he wants to leave Boston and his family.Ronny's plans change, however, when his politically incorrect and outspoken father, Arthur stuns everyone with his choice for an assistant. Touched by his father's offer, Ronny embarks on a completely different future and he can be sure that his loving family, including his twin brothers Sean and Gerard and his sister Jackie, are going to have a very vocal opinion about it."
137,Cristela,https://static.tvmaze.com/uploads/images/medium_portrait/0/1932.jpg,"Comedy, Legal",English,Scripted,Ended,2014-10-10,30,7.0,ABC,1,22,"Andrew Leeds, Carlos Ponce, Maria Canals-Barrera, Terri Hoyos, Cristela Alonzo, Sam McMurray, Justine Lupe, Isabella Day, Jacob Guenther",Cristela's dream of becoming a lawyer is something her traditional Mexican-American family doesn't quite understand. She's entering her sixth year of law school after juggling home obligations and working multiple jobs to pay her way.
138,The Leftovers,https://static.tvmaze.com/uploads/images/medium_portrait/503/1259794.jpg,"Drama, Science-Fiction, Thriller",English,Scripted,Ended,2014-06-29,61,8.0,HBO,3,28,"Justin Theroux, Carrie Coon, Christopher Eccleston, Amy Brenneman, Margaret Qualley, Ann Dowd, Chris Zylka, Kevin Carroll, Liv Tyler, Janel Moloney, Jovan Adepo, Scott Glenn, Amanda Warren, Michael Gaston, Annie Q. Riegel, Emily Meade, Regina King, Charlie Carver, Max Carver","Three years after millions of people—some 2% of the world's population—vanished into thin air, residents of Mapleton, NY weigh the pros and cons of a ""Heroes Day"" tribute to the local ""Departed"". Attempting to maintain a sense of normalcy in his strained community, police chief Kevin Garvey faces additional challenges at home with his daughter, Jill, who's lost in a cloud of apathy with her friend Aimee, and son, Tom, who has gravitated to a cult led by the charismatic Holy Wayne. Also of concern is a silent, white-clad group of chain-smoking men and women called the Guilty Remnant, who team up in pairs to stake out people and places around town. As tension in Mapleton escalates, the lives of Laurie, an unexpected member of the Guilty Remnant, and Meg, a recently engaged young woman, converge."
139,Girls,https://static.tvmaze.com/uploads/images/medium_portrait/31/78286.jpg,"Drama, Romance",English,Scripted,Ended,2012-04-15,30,6.4,HBO,6,62,"Lena Dunham, Allison Williams, Jemima Kirke, Zosia Mamet, Adam Driver, Alex Karpovsky, Andrew Rannells, Ebon Moss-Bachrach",This Emmy winning series is a comic look at the assorted humiliations and rare triumphs of a group of girls in their 20s.
140,Looking,https://static.tvmaze.com/uploads/images/medium_portrait/0/1961.jpg,"Drama, Comedy, Romance",English,Scripted,Ended,2014-01-19,32,7.2,HBO,2,18,"Jonathan Groff, Frankie J. Alvarez, Murray Bartlett, Lauren Weedman, Russell Tovey, Raúl Castillo","Looking offers up the unfiltered experiences of three close friends living - and loving - in modern-day San Francisco. Friendship may bind them, but each is at a markedly different point in his journey: Patrick is the 29-year-old video game designer getting back into the dating world in the wake of his ex's engagement; aspiring artist Agustín, 31, is questioning the idea of monogamy amid a move to domesticate with his boyfriend; and the group's oldest member - longtime waiter Dom, 39 - is facing middle age with romantic and professional dreams still unfulfilled.The trio's stories intertwine and unspool dramatically as they search for happiness and intimacy in an age of unparalleled choices - and rights - for gay men. Also important to the ‘Looking' mix is the progressive, unpredictable, sexually open culture of the Bay Area, with real San Francisco locations serving as a backdrop for the group's lives. Rounding out the ‘Looking' world are a bevy of dynamic gay men including Kevin, Lynn, and Richie, as well as a wide-range of supporting characters like Dom's roommate Doris, Agustín's boyfriend Frank, and Patrick's co-worker Owen."
141,Getting On,https://static.tvmaze.com/uploads/images/medium_portrait/0/1970.jpg,"Comedy, Medical",English,Scripted,Ended,2013-11-24,30,7.1,HBO,3,18,"Alex Borstein, Laurie Metcalf, Mel Rodriguez, Niecy Nash","From creators Mark V. Olsen and Will Scheffer, the series follows the daily lives of nurses and doctors as they struggle with the darkly comic realities of caring for the elderly in an overwhelmed healthcare system, skewering the petty bureaucracies of modern medical practice in America."
142,Veep,https://static.tvmaze.com/uploads/images/medium_portrait/189/472887.jpg,Comedy,English,Scripted,Ended,2012-04-22,30,7.8,HBO,7,65,"Julia Louis-Dreyfus, Anna Chlumsky, Tony Hale, Reid Scott, Timothy Simons, Matt Walsh, Gary Cole, Kevin Dunn, Sufe Bradshaw, Sarah Sutherland, Sam Richardson, Clea DuVall","Former Senator Selina Meyer has accepted the call to serve as Vice President of the United States. The job is nothing like she imagined and everything she was warned about. Veep follows Meyer and her staff as they attempt to make their mark and leave a lasting legacy, without getting tripped up in the day-to-day political games that define Washington."
143,Silicon Valley,https://static.tvmaze.com/uploads/images/medium_portrait/215/538434.jpg,Comedy,English,Scripted,Ended,2014-04-06,30,8.4,HBO,6,53,"Thomas Middleditch, Martin Starr, Kumail Nanjiani, Zach Woods, Matt Ross, Amanda Crew, Josh Brener, T.J. Miller, Jimmy O. Yang, Suzanne Cryer, Chris Diamantopoulos, Stephen Tobolowsky, Christopher Evan Welch","In the high-tech gold rush of modern Silicon Valley, the people most qualified to succeed are the least capable of handling success. From Mike Judge comes this satire about a programmer whose game-changing algorithm becomes the subject of a valley-wide bidding war."
144,The Comeback,https://static.tvmaze.com/uploads/images/medium_portrait/616/1541026.jpg,Comedy,English,Scripted,Running,2005-06-05,30,7.9,HBO,3,29,"Damian Young, Lisa Kudrow, Lance Barber, Robert Michael Morris, Laura Silverman, Malin Akerman, Robert Bagnell","The limited comedy series stars Lisa Kudrow as the embattled Valerie Cherish, a fading TV ""It Girl"" who was once so desperate to stay in the spotlight that she allowed cameras to follow her every move as she appeared on a new sitcom - with disastrous results. Now, it's ten years later, and Valerie thinks she has it all figured out this time. She doesn't."
145,House of Lies,https://static.tvmaze.com/uploads/images/medium_portrait/0/2003.jpg,"Drama, Comedy",English,Scripted,Ended,2012-01-08,30,7.9,Paramount+ with Showtime,5,58,"Don Cheadle, Kristen Bell, Ben Schwartz, Josh Lawson, Donis Leonard Jr., Glynn Turman, Dawn Olivieri","Charming, fast talking Marty Kaan and his crack team of management consultants know how to play the corporate game better than anyone, by using every dirty trick in the book to woo powerful CEOs and close huge deals. In the board rooms, barrooms, and bedrooms of the power elite, corruption is business as usual and everyone's out for themselves first. Nothing is sacred in this scathing, irreverent satire of corporate America today."
146,Episodes,https://static.tvmaze.com/uploads/images/medium_portrait/123/309535.jpg,Comedy,English,Scripted,Ended,2011-01-09,30,7.9,Paramount+ with Showtime,5,41,"Matt LeBlanc, Stephen Mangan, Tamsin Greig, Kathleen Rose Perkins, John Pankow, Mircea Monroe","Matt LeBlanc stars as Matt LeBlanc in Episodes, the hilarious comedy series about remaking a comedy series. When husband and wife writing team Sean and Beverly set out to reproduce their British TV hit for an American network, all of their worst fears come true as Hollywood lives up to its reputation for absurdity. Not only does the network cast Matt LeBlanc in the starring role, but Matt takes the lead in deviously twisting their beloved series into a terrible cliché, while testing the couple's marriage with diversions and temptations."
147,Nurse Jackie,https://static.tvmaze.com/uploads/images/medium_portrait/0/2021.jpg,"Drama, Comedy",English,Scripted,Ended,2009-06-08,30,7.8,Paramount+ with Showtime,7,80,"Edie Falco, Merritt Wever, Paul Schulze, Stephen Wallem, Peter Facinelli, Anna Deavere Smith, Ruby Jerins, Dominic Fumusa, Mackenzie Aladjem, Eve Best, Betty Gilpin, Adam Ferrara, Haaz Sleiman","Every day is a matter of life and death in a hectic New York City hospital, but for Nurse Jackie that's the easiest part. Between chronic back pain that won't quit, and a personal life on the constant edge of collapse, it's going to take a white lie here, a bent rule there, and a handful of secret strategies to relieve the pain, and stay one step ahead of total disaster."
148,Web Therapy,https://static.tvmaze.com/uploads/images/medium_portrait/0/2036.jpg,Comedy,English,Scripted,Ended,2011-07-19,30,7.1,Paramount+ with Showtime,4,44,Lisa Kudrow,"Fiona Wallice is a therapist with little patience for her patients. Tired of hearing about people's problems for fifty long minutes, she devises a new treatment, the three-minute video chat. And still, the sessions end up being largely about her. If she's your therapist, you've got problems. Emmy Award® winner Lisa Kudrow co-created, produces and stars in this outrageous therapeutic send-up. Originally produced as webisodes, Web Therapy features an A-list guest cast who, along with Kudrow, improvise their performances with hilarious results."
